{
  "schema": "fmea-mining.playbook-causal-crosswalk.v1",
  "version": "1.3.19",
  "nature": "editorial_candidate_mapping_not_sap_or_oem_approved",
  "sourceDeepDive": "data/quality/playbook-deepdives-remaining.v1.json",
  "counts": {
    "playbookHypothesesReviewed": 18,
    "hypothesesWithCandidates": 13,
    "hypothesesWithoutEquivalent": 5,
    "candidateLinks": 18,
    "confirmedMappings": 0
  },
  "records": [
    {
      "id": "XW-PB-EXC-PUMP-01-H1",
      "playbookId": "PB-EXC-PUMP-01",
      "hypothesisId": "H1",
      "hypothesisLabel": "Vazamento externo em vedação da bomba",
      "deepDiveId": "DEEP-EXC395-PUMP-001",
      "candidates": [],
      "assessment": "sem_cadeia_equivalente_demonstrada",
      "confirmedMapping": false,
      "approvedSerialOrArrangement": null,
      "approvedSapLocation": null,
      "independentReviewStatus": "pendente",
      "observedCase": null,
      "unmappedRationale": "O catálogo de 24 cadeias não cobre mecanismo específico de vedação ou eficiência de bomba hidráulica; vedação de bomba d’água não é equivalente."
    },
    {
      "id": "XW-PB-EXC-PUMP-01-H2",
      "playbookId": "PB-EXC-PUMP-01",
      "hypothesisId": "H2",
      "hypothesisLabel": "Vazamento de linha ou conexão próximo à bomba",
      "deepDiveId": "DEEP-EXC395-PUMP-001",
      "candidates": [
        {
          "chainId": "FC-HOSE-003",
          "relationship": "candidate_mechanism_overlap_only",
          "mechanicalBasis": "Fuga em interface mangueira–terminal é mecanismo concorrente quando a conexão adjacente for identificada como parte da linha suspeita.",
          "applicabilityLimitation": "Não comprova que uma mangueira específica da CAT 395 esteja instalada junto à bomba nem uma fuga física."
        }
      ],
      "assessment": "candidatos_conceituais_nao_aprovados",
      "confirmedMapping": false,
      "approvedSerialOrArrangement": null,
      "approvedSapLocation": null,
      "independentReviewStatus": "pendente",
      "observedCase": null,
      "unmappedRationale": null
    },
    {
      "id": "XW-PB-EXC-PUMP-01-H3",
      "playbookId": "PB-EXC-PUMP-01",
      "hypothesisId": "H3",
      "hypothesisLabel": "Limitação de desempenho sem vazamento físico confirmado",
      "deepDiveId": "DEEP-EXC395-PUMP-001",
      "candidates": [],
      "assessment": "sem_cadeia_equivalente_demonstrada",
      "confirmedMapping": false,
      "approvedSerialOrArrangement": null,
      "approvedSapLocation": null,
      "independentReviewStatus": "pendente",
      "observedCase": null,
      "unmappedRationale": "O catálogo de 24 cadeias não cobre mecanismo específico de vedação ou eficiência de bomba hidráulica; vedação de bomba d’água não é equivalente."
    },
    {
      "id": "XW-PB-EXC-HOSE-01-H1",
      "playbookId": "PB-EXC-HOSE-01",
      "hypothesisId": "H1",
      "hypothesisLabel": "Vazamento em interface de vedação ou conexão",
      "deepDiveId": "DEEP-EXC395-HOSE-001",
      "candidates": [
        {
          "chainId": "FC-HOSE-003",
          "relationship": "candidate_mechanism_overlap_only",
          "mechanicalBasis": "Perda pela interface mangueira–terminal coincide conceitualmente com vazamento de conexão do playbook.",
          "applicabilityLimitation": "Não presume terminal efetivo, montagem, PN nem ponto real da fuga."
        }
      ],
      "assessment": "candidatos_conceituais_nao_aprovados",
      "confirmedMapping": false,
      "approvedSerialOrArrangement": null,
      "approvedSapLocation": null,
      "independentReviewStatus": "pendente",
      "observedCase": null,
      "unmappedRationale": null
    },
    {
      "id": "XW-PB-EXC-HOSE-01-H2",
      "playbookId": "PB-EXC-HOSE-01",
      "hypothesisId": "H2",
      "hypothesisLabel": "Deterioração da mangueira por abrasão externa",
      "deepDiveId": "DEEP-EXC395-HOSE-001",
      "candidates": [
        {
          "chainId": "FC-HOSE-001",
          "relationship": "candidate_mechanism_overlap_only",
          "mechanicalBasis": "Abrasão externa e possível perda de contenção são explicitamente o mecanismo catalogado na cadeia de mangueira.",
          "applicabilityLimitation": "Contato visual e óleo superficial não demonstram perfuração ou falha funcional."
        }
      ],
      "assessment": "candidatos_conceituais_nao_aprovados",
      "confirmedMapping": false,
      "approvedSerialOrArrangement": null,
      "approvedSapLocation": null,
      "independentReviewStatus": "pendente",
      "observedCase": null,
      "unmappedRationale": null
    },
    {
      "id": "XW-PB-EXC-HOSE-01-H3",
      "playbookId": "PB-EXC-HOSE-01",
      "hypothesisId": "H3",
      "hypothesisLabel": "Óleo proveniente de outro ponto e transportado por gravidade",
      "deepDiveId": "DEEP-EXC395-HOSE-001",
      "candidates": [],
      "assessment": "sem_cadeia_equivalente_demonstrada",
      "confirmedMapping": false,
      "approvedSerialOrArrangement": null,
      "approvedSapLocation": null,
      "independentReviewStatus": "pendente",
      "observedCase": null,
      "unmappedRationale": "Óleo proveniente de peça situada acima é hipótese de localização, não modo de falha definido para a mangueira."
    },
    {
      "id": "XW-PB-SHOVEL-COOL-01-H1",
      "playbookId": "PB-SHOVEL-COOL-01",
      "hypothesisId": "H1",
      "hypothesisLabel": "Fluxo de ar restringido na colmeia ou pacote de radiadores",
      "deepDiveId": "DEEP-CAT6030-COOL-001",
      "candidates": [
        {
          "chainId": "FC-COOL-001",
          "relationship": "candidate_mechanism_overlap_only",
          "mechanicalBasis": "Depósito externo que restringe passagem de ar pela colmeia coincide com mecanismo de dissipação térmica.",
          "applicabilityLimitation": "Sem efetividade para a arquitetura CAT 6030 ou medida de vazão térmica."
        }
      ],
      "assessment": "candidatos_conceituais_nao_aprovados",
      "confirmedMapping": false,
      "approvedSerialOrArrangement": null,
      "approvedSapLocation": null,
      "independentReviewStatus": "pendente",
      "observedCase": null,
      "unmappedRationale": null
    },
    {
      "id": "XW-PB-SHOVEL-COOL-01-H2",
      "playbookId": "PB-SHOVEL-COOL-01",
      "hypothesisId": "H2",
      "hypothesisLabel": "Perda de fluido do circuito de arrefecimento",
      "deepDiveId": "DEEP-CAT6030-COOL-001",
      "candidates": [
        {
          "chainId": "FC-COOL-002",
          "relationship": "candidate_mechanism_overlap_only",
          "mechanicalBasis": "Perda externa por mangueira ou conexão no arrefecimento coincide com condição funcional catalogada.",
          "applicabilityLimitation": "Nível baixo não localiza fuga nem confirma componente."
        }
      ],
      "assessment": "candidatos_conceituais_nao_aprovados",
      "confirmedMapping": false,
      "approvedSerialOrArrangement": null,
      "approvedSapLocation": null,
      "independentReviewStatus": "pendente",
      "observedCase": null,
      "unmappedRationale": null
    },
    {
      "id": "XW-PB-SHOVEL-COOL-01-H3",
      "playbookId": "PB-SHOVEL-COOL-01",
      "hypothesisId": "H3",
      "hypothesisLabel": "Ventilação insuficiente por anomalia de ventilador/acionamento",
      "deepDiveId": "DEEP-CAT6030-COOL-001",
      "candidates": [
        {
          "chainId": "FC-COOL-003",
          "relationship": "candidate_mechanism_overlap_only",
          "mechanicalBasis": "Ventilação deficiente quando demandada coincide com hipótese de falha de acionamento ventilador.",
          "applicabilityLimitation": "Ventilador, arquitetura e canais de comando dependem da série efetiva."
        }
      ],
      "assessment": "candidatos_conceituais_nao_aprovados",
      "confirmedMapping": false,
      "approvedSerialOrArrangement": null,
      "approvedSapLocation": null,
      "independentReviewStatus": "pendente",
      "observedCase": null,
      "unmappedRationale": null
    },
    {
      "id": "XW-PB-TRUCK-FINAL-01-H1",
      "playbookId": "PB-TRUCK-FINAL-01",
      "hypothesisId": "H1",
      "hypothesisLabel": "Deterioração de rolamento em comando final",
      "deepDiveId": "DEEP-CAT777-FINAL-001",
      "candidates": [
        {
          "chainId": "FC-FD-004",
          "relationship": "candidate_mechanism_overlap_only",
          "mechanicalBasis": "Spalling e desgaste de contato em rolamentos são mecanismos candidatos para deterioração de rolamento.",
          "applicabilityLimitation": "Ruído e metal em óleo não localizam dano no rolamento do comando final específico."
        }
      ],
      "assessment": "candidatos_conceituais_nao_aprovados",
      "confirmedMapping": false,
      "approvedSerialOrArrangement": null,
      "approvedSapLocation": null,
      "independentReviewStatus": "pendente",
      "observedCase": null,
      "unmappedRationale": null
    },
    {
      "id": "XW-PB-TRUCK-FINAL-01-H2",
      "playbookId": "PB-TRUCK-FINAL-01",
      "hypothesisId": "H2",
      "hypothesisLabel": "Desgaste de engrenagens do comando final",
      "deepDiveId": "DEEP-CAT777-FINAL-001",
      "candidates": [],
      "assessment": "sem_cadeia_equivalente_demonstrada",
      "confirmedMapping": false,
      "approvedSerialOrArrangement": null,
      "approvedSapLocation": null,
      "independentReviewStatus": "pendente",
      "observedCase": null,
      "unmappedRationale": "Cadeias disponíveis descrevem desgaste ou ingresso com dano possível; esta hipótese não demonstra o mecanismo e exige nova curadoria."
    },
    {
      "id": "XW-PB-TRUCK-FINAL-01-H3",
      "playbookId": "PB-TRUCK-FINAL-01",
      "hypothesisId": "H3",
      "hypothesisLabel": "Contaminação ou lubrificante não conforme sem falha mecânica confirmada",
      "deepDiveId": "DEEP-CAT777-FINAL-001",
      "candidates": [],
      "assessment": "sem_cadeia_equivalente_demonstrada",
      "confirmedMapping": false,
      "approvedSerialOrArrangement": null,
      "approvedSapLocation": null,